FORM_NAME,FIELD_TYPE,SRC_CODE,SRC_CD_DESCRIPTION,TARGET_CONCEPT_ID,TARGET_CONCEPT_NAME,TARGET_DOMAIN_ID,TARGET_VOCABULARY_ID,TARGET_CONCEPT_CLASS_ID,TARGET_STANDARD_CONCEPT,TARGET_CONCEPT_CODE,NOTES,,,"Choices, Calculations, OR Slider Labels",Field Note
ehr_information,text,record_id,Screening ID,,,,,,,,,,,,
ehr_information,text,doc,Record Creation Date,,,,,,,,,,,,
ehr_information,text,mrn,MRN,,,,,,,,,,,,
ehr_information,text,brthdat,Birth Date,,,,,,,,,,,,
ehr_information,],sex,Sex at birth,46235213,Sex assigned at birth,Observation,LOINC,Clinical Observation,S,76689-9,,,,"F, Female | M, Male | I, Intersex | 99, Not available",
ehr_information,text,language,Primary Language,3043205,Language.primary,Observation,LOINC,Clinical Observation,S,45402-5,,,,,
ehr_information,text,race_ehr,EHR Race,3046853,Race,Observation,LOINC,Clinical Observation,S,32624-9,,,,,
ehr_information,text,ethnic_ehr,EHR Ethnicity,,,,,,,,,,,,
ehr_information,text,fname,First,,,,,,,,,,,,
ehr_information,text,lname,Last,,,,,,,,,,,,
ehr_information,text,home_ph,Home Phone,,,,,,,,,,,,
ehr_information,text,cell_ph,Cell Phone,,,,,,,,,,,,
ehr_information,text,email,Email Address,,,,,,,,,,,,
ehr_information,text,recruitment_access_code, Recruitment survey access code,,,,,,,,,,,,
ehr_information,text,recruitment_url, Recruitment survey url,,,,,,,,,,,,
mailing_information,text,street,Street/PO Box,,,,,,,,,,,,
mailing_information,text,city,City,40771522,City,Observation,LOINC,Survey,S,68997-6,,,,,
mailing_information,dropdown,state,State,3052558,State of residence,Observation,LOINC,Survey,S,46499-0,,,,"AL, Alabama | AK, Alaska | AZ, Arizona | AR, Arkansas | CA, California | CO, Colorado | CT, Connecticut | DE, Delaware | FL, Florida | GA, Georgia | HI, Hawaii | ID, Idaho | IL, Illinois | IN, Indiana | IA, Iowa | KS, Kansas | KY, Kentucky | LA, Louisiana | ME, Maine | MD, Maryland | MA, Massachusetts | MI, Michigan | MN, Minnesota | MS, Mississippi | MO, Missouri | MT, Montana | NE, Nebraska | NV, Nevada | NH, New Hampshire | NJ, New Jersey | NM, New Mexico | NY, New York | NC, North Carolina | ND, North Dakota | OH, Ohio | OK, Oklahoma | OR, Oregon | PA, Pennsylvania | RI, Rhode Island | SC, South Carolina | SD, South Dakota | TN, Tennessee | TX, Texas | UT, Utah | VT, Vermont | VA, Virginia | WA, Washington | WV, West Virginia",
mailing_information,text,zip,Zip Code,,,,,,,,,,,,
recruitment_survey_management,text,mgmtdat,Date initial mailing to be sent,,,,,,,,,,,,
recruitment_survey_management,text,siteid,Site,,,,,,,,,,,,
recruitment_survey_management,calc,age,Age,4265453,Age,Observation,SNOMED,Qualifier Value,S,397669002,,,,"rounddown(datediff([brthdat],[mgmtdat],'y', true),2)",
recruitment_survey_management,checkbox,screen_alert_trigger,FAQ Follow Up Move participant forward to Screening,,,,,,,,,,,"1, Send participant invitation to resume surveys starting at the <em style=""color: #169179;"">Screening survey",
recruitment_survey_management,checkbox,consent_alert_trigger,Move participant forward to Consent,,,,,,,,,,,"1, Send participant invitation to resume surveys starting at the <em style=""color: #169179;"">Consent survey",
recruitment_survey_management,checkbox,stop_srvy,Cancel survey invitations,,,,,,,,,,,"1, Checking this box and saving the form cancels any scheduled automated invitations and prevents any future invitations from being scheduled",
recruitment_survey,text,reccmpdat,Recruitment survey date (date survey/form opened),,,,,,,,,,,,
recruitment_survey,text,rec_crcid,Interviewer Code,,,,,,,,,,,,
recruitment_survey,checkbox,recruit_nd,No participant response,,,,,,,,,,,"999, Recruitment survey not done",
recruitment_survey,radio,scrn_intst1,Are you interested to learn if you're eligible for our research study?,,,,,,,,,,,"1, Yes, I'm interested | 2, I have questions | 0, No I'm not interested at this time",
recruitment_survey,text,recstartts,Recruitment Survey Started Timestamp (from REDCap),,,,,,,,,,,,
recruitment_survey,text,reccmpts,Recruitment Survey Completed Timestamp (from REDCap),,,,,,,,,,,,
faq_survey,text,faqcmpdat,FAQ survey date (date survey/form opened),,,,,,,,,,,,
faq_survey,text,crcid_faq,Interviewer Code,,,,,,,,,,,,
faq_survey,checkbox,faq_nd,No participant response,,,,,,,,,,,"999, FAQ survey not done",
faq_survey,radio,scrn_intst2,Are you interested in learning if you're eligible for our research study?,,,,,,,,,,,"1, Yes, I'm interested | 2, I still have questions and I would like to have a staff member call me | 0, No I'm not interested at this time",
faq_survey,text,faqstartts,FAQ Survey Started Timestamp (from REDCap),,,,,,,,,,,,
faq_survey,text,faqcmpts,FAQ Survey Completed Timestamp (from REDCap),,,,,,,,,,,,
screening_survey,text,scrcmpdat,Screening survey date (date survey/form opened),,,,,,,,,,,,
screening_survey,text,crcid_scrn,Interviewer Code,,,,,,,,,,,,
screening_survey,checkbox,screen_nd,No participant response,,,,,,,,,,,"999, Screening survey not done",
screening_survey,yesno,rp_childpot,Are you currently pregnant?,45884583,Currently pregnant,Meas Value,LOINC,Answer,S,LA14670-6,,,,,
screening_survey,yesno,mhterm_dm1,Type I Diabetes,45883360,Diabetes Type 1,Meas Value,LOINC,Answer,S,LA10551-2,,,,,
screening_survey,yesno,mh_a1c,Elevated A1C levels (elevated blood sugars),,,,,,,,,,,,
screening_survey,yesno,mhterm_dm2,Type II Diabetes,45877606,Diabetes Type 2,Meas Value,LOINC,Answer,S,LA10552-0,,,,,
screening_survey,text,mh_dm_age,"If yes, at what age were you first diagnosed?",,,,,,,,,,,,
screening_survey,yesno,mhterm_predm,Pre-diabetes,,,,,,,,,,,,
screening_survey,radio,cmtrt_a1c,"Do you take pills to control your A1C and blood glucose levels? Examples: Metformin (Glucophage, Glumetza, Fortamet, Riomet), Glucotrol, Amaryl, DiaBeta, Blynase PresTab, Micronase, Actos, Avandia, Precose, Glyset, Prandin, Starlix, Januvia, Onglyza, Tradjenta, Nesina, Invokana, Farxiga, Jardiance, Welchol, and Cyclocet",,,,,,,,,,,"1, Yes | 0, No",
screening_survey,yesno,cmtrt_insln,Do you inject insulin to control your blood glucose levels?,40768857,Are you now taking insulin [PhenX],Observation,LOINC,Clinical Observation,S,66175-1,,,,,
screening_survey,yesno,cmtrt_glcs,"Do you use other injections to control your blood glucose levels?  Examples: Victoza, Ozempic, Symlin, Tanzeum, and Trulicity",,,,,,,,,,,,
screening_survey,yesno,cmtrt_lfst,"Do you use lifestyle changes to control your A1C and blood glucose levels? Examples: regular exercise, avoiding sugary foods and beverages, eating a balanced diet with lots of vegetables, sticking to a consistent eating schedule",,,,,,,,,,,,
screening_survey,radio,scrsex,"What sex were you assigned at birth? That is, what is on your original birth certificate?",,,,,,,,,,,"F, Female | M, Male | I, Intersex | 888, Other | 777, Prefer not to say",
screening_survey,text,scrsexot,Other (please specify),,,,,,,,,,,,
screening_survey,checkbox,ethnic,"Are you of Hispanic, Latina/x or Spanish origin? Please check all that apply.",,,,,,,,,,,"C41222, No | C67113, Yes, Mexican | C67112, Yes, Puerto Rican | C107608, Yes, Cuban | C67117, Yes, Dominican Republic | C67118, Yes, Central American | C126532, Yes, South American | C999, Yes, Chicano | 888, Yes, Other | 777, Prefer not to say",
screening_survey,text,ethnicot,Other (please specify),,,,,,,,,,,,
screening_survey,calc,ethnicscore, Hispanic score (needed for demographics screening logic),,,,,,,,,,,"if([rp_childpot] = '0' and [mhterm_dm1] = '0' and [screen_nd(999)] = '0', if(sum([ethnic(C67113)],[ethnic(C67112)],[ethnic(C107608)],[ethnic(C67117)],[ethnic(C67118)],[ethnic(C126532)],[ethnic(C999)],[ethnic(888)]) >= 1, 1, 0), '')",
screening_survey,checkbox,race,How would you describe your race/ethnicity? (check all that apply),,,,,,,,,,,"C17459, American Indian or Alaska Native | C41260, Asian | C16352, Black or African American | C77820, Middle Eastern | C41219, Native Hawaiian or Pacific Islander | C77813, North African | C41261, White or Caucasian | 888, Other race, ethnicity or origin | 777, Prefer not to say",
screening_survey,text,raceot,Other (please describe),,,,,,,,,,,,
screening_survey,text,racetrib,Tribal affiliation (please describe),,,,,,,,,,,,
screening_survey,radio,race2,Which one of these groups would you say best represents your race?,,,,,,,,,,,"C17459, American Indian or Alaska Native | C41260, Asian | C16352, Black or African American | C77820, Middle Eastern | C41219, Native Hawaiian or other Pacific Islander | C77813, North African | C41261, White or Caucasian | 888, Other race, ethnicity or origin | 777, Prefer not to say",
screening_survey,text,ancestry,"What is your ancestry or ethnic origin?(Examples: Italian, Jamaican, African American, Cambodian, Cape Verdean, Cherokee, Navajo, Nez Pearce, Norwegian, Dominican, French Canadian, Haitian, Korean, Lebanese, Polish, Nigerian, Mexican, Taiwanese, Ukrainian, and so on.)",,,,,,,,,,,,
screening_survey,text,scrstartts, Screening Survey Started Timestamp (from REDCap),,,,,,,,,,,,
screening_survey,text,scrcmpts, Screening Survey Completed Timestamp (from REDCap),,,,,,,,,,,,
screening_survey,text,racescore, Race raw value (checkbox & radio),,,,,,,,,,,,
screening_survey,text,racerawvalue_1, Race raw value (checkbox),,,,,,,,,,,,
screening_survey,text,racerawvalue_2, Race raw value (radio),,,,,,,,,,,,
preconsent_survey,text,preconcmpdat, Pre-consent survey/form date (date survey/form opened),,,,,,,,,,,,
preconsent_survey,text,crcid_prcon,Interviewer Code,,,,,,,,,,,,
preconsent_survey,checkbox,precon_nd,No participant response,,,,,,,,,,,"999, Pre-consent survey not done",
preconsent_survey,radio,icf_c16468,"You have the option to continue to our informed consent document, which contains more details on the data to be collected, as well as your rights as a volunteer. You also have the option to request that a study team member call you to answer any questions you have, or choose not to participate and exit this website.",,,,,,,,,,,"1, Yes, I'd like to enroll in the study and complete the consent form | 2, I have questions and would like to receive a call from study staff | 0, No, I do not want to enroll in the study",
preconsent_survey,text,preconstartts, Pre-consent Survey Started Timestamp (from REDCap),,,,,,,,,,,,
preconsent_survey,text,preconcmpts, Pre-consent Survey Completed Timestamp (from REDCap),,,,,,,,,,,,
consent_survey,text,icf_dat, Consent survey/form date (date survey/form opened),,,,,,,,,,,,
consent_survey,text,crcid_icf,Interviewer Code,,,,,,,,,,,,
consent_survey,checkbox,icf_nd, No participant response,,,,,,,,,,,"999, Consent survey not done",
consent_survey,checkbox,c184390,Paper consent obtained,,,,,,,,,,,"1, Check this box to confirm that paper consent was obtained",
consent_survey,text,c184390_dat,Date paper consent completed,,,,,,,,,,,,
consent_survey,radio,icf_version, Version,,,,,,,,,,,"1, MM/DD/YYYY",
consent_survey,radio,icf_consent,I have read this entire form and I agree to be in this study.,,,,,,,,,,,"1, Yes, I agree to participate | 0, No, I do not agree to participate",
consent_survey,text,icf_fname,Your First Name,,,,,,,,,,,,
consent_survey,text,icf_lname,Your Last Name,,,,,,,,,,,,
consent_survey,file,icf_sign,Your Signature,,,,,,,,,,,,
consent_survey,text,icfsvyts, Consent Survey Start Timestamp,,,,,,,,,,,,
consent_survey,text,icfcmpts,Consent Survey Completed Timestamp,,,,,,,,,,,,
staff_consent_attestation_survey,text,icfa_version,Version,,,,,,,,,,,,
staff_consent_attestation_survey,checkbox,icfa_attestation,Consent Attestation,,,,,,,,,,,"1, I confirm [icf_fname] [icf_lname] gave consent.",
staff_consent_attestation_survey,text,icfa_dat,Date of Consent Attestation,,,,,,,,,,,,
staff_consent_attestation_survey,text,icfa_fname,Study Staff First Name,,,,,,,,,,,,
staff_consent_attestation_survey,text,icfa_lname,Study Staff Last Name,,,,,,,,,,,,
staff_consent_attestation_survey,file,icfa_sign,Study Staff Signature,,,,,,,,,,,,
download_consent,file,icf_pdf, You can download your completed consent form by clicking on the link below.,,,,,,,,,,,,
participant_contact_information_survey,text,prtcmpdat,Participant contact survey/form date (date survey/form opened),,,,,,,,,,,,
participant_contact_information_survey,text,crcid_prt,Interviewer Code,,,,,,,,,,,,
participant_contact_information_survey,checkbox,parcon_nd, No participant response,,,,,,,,,,,"999, Participant contact survey not done",
participant_contact_information_survey,text,prt_street,Street/PO Box,,,,,,,,,,,,
participant_contact_information_survey,text,prt_city,City,40771522,City,Observation,LOINC,Survey,S,68997-6,,,,,
participant_contact_information_survey,dropdown,prt_state,State,3052558,State of residence,Observation,LOINC,Survey,S,46499-0,,,,"AL, Alabama | AK, Alaska | AZ, Arizona | AR, Arkansas | CA, California | CO, Colorado | CT, Connecticut | DE, Delaware | FL, Florida | GA, Georgia | HI, Hawaii | ID, Idaho | IL, Illinois | IN, Indiana | IA, Iowa | KS, Kansas | KY, Kentucky | LA, Louisiana | ME, Maine | MD, Maryland | MA, Massachusetts | MI, Michigan | MN, Minnesota | MS, Mississippi | MO, Missouri | MT, Montana | NE, Nebraska | NV, Nevada | NH, New Hampshire | NJ, New Jersey | NM, New Mexico | NY, New York | NC, North Carolina | ND, North Dakota | OH, Ohio | OK, Oklahoma | OR, Oregon | PA, Pennsylvania | RI, Rhode Island | SC, South Carolina | SD, South Dakota | TN, Tennessee | TX, Texas | UT, Utah | VT, Vermont | VA, Virginia | WA, Washington | WV, West Virginia",
participant_contact_information_survey,text,prt_zip,Zip Code,,,,,,,,,,,,
participant_contact_information_survey,text,prt_email,Email Address,,,,,,,,,,,,
participant_contact_information_survey,text,prt_phone,Phone (best number to contact you),,,,,,,,,,,,
participant_contact_information_survey,yesno,prt_cell_phone,Is this a cell phone?,,,,,,,,,,,,
participant_contact_information_survey,text,prt_phone_2,Alternate phone number,,,,,,,,,,,,
participant_contact_information_survey,yesno,prt_cell_phone_2,Is the alternate phone number a cell phone?,,,,,,,,,,,,
participant_contact_information_survey,radio,prefmthd,Preferred mode of contact?,,,,,,,,,,,"1, Phone call | 2, Text message | 3, Email | 4, Mail",
participant_contact_information_survey,checkbox,add_enrolled,Add participant record to Enrolled Project,,,,,,,,,,,"1, Checking this box and saving the form will add [record_id] to the Enrolled project as a consented participant",
participant_contact_information_survey,text,prtstartts,Participant Contact Survey Started Timestamp (from REDCap),,,,,,,,,,,,
participant_contact_information_survey,text,prtcmpts,Participant Contact Survey Completed Timestamp (from REDCap),,,,,,,,,,,,
demographics_survey,text,dmgcmpdat,Demographic survey date (date survey/form opened),,,,,,,,,,,,
demographics_survey,text,crcid_dmg,Interviewer Code,,,,,,,,,,,,
demographics_survey,checkbox,dmg_nd,No participant response,,,,,,,,,,,"999, Recruitment survey not done",
demographics_survey,dropdown,brthmm,Month (e.g. Jan or Feb),,,,,,,,,,,"1, January | 2, February | 3, Mar | 4, April | 5, May | 6, June | 7, July | 8, August | 9, September | 10, October | 11, November | 12, December | 0, Unknown",
demographics_survey,dropdown,brthdd,Day (01 - 31),,,,,,,,,,,"1, 1 | 2, 2 | 3, 3 | 4, 4 | 5, 5 | 6, 6 | 7, 7 | 8, 8 | 9, 9 | 10, 10 | 11, 11 | 12, 12 | 13, 13 | 14, 14 | 15, 15 | 16, 16 | 17, 17 | 18, 18 | 19, 19 | 20, 20 | 21, 21 | 22, 22 | 23, 23 | 24, 24 | 25, 25 | 26, 26 | 27, 27 | 28, 28 | 29, 29 | 30, 30 | 31, 31 | 0, Unknown",
demographics_survey,text,brthyy,Year (e.g. 1967),,,,,,,,,,,,
demographics_survey,text,cage,Age (in years),4265453,Age,Observation,SNOMED,Qualifier Value,S,397669002,,,,,
demographics_survey,radio,cl_maristat,Marital Status,,,,,,,,,,,"C51773, Married | C51774, Single | C51776, Divorced | C51775, Widowed | C53262, Domestic Partner | C51777, Living separately but not divorced | 888, Other | 777, Prefer not to say",
demographics_survey,text,cl_maristatot,Other (please specify),,,,,,,,,,,,
demographics_survey,radio,genderid,What gender do you identify as?,,,,,,,,,,,"1, Man (including transgender men) | 2, Woman (including transgender women) | 3, Non-binary | 888, Other | 777, Prefer not to say",
demographics_survey,text,genderidot,Other (please specify),,,,,,,,,,,,
demographics_survey,text,dmgstartts, Demographics Survey Started Timestamp (from REDCap),,,,,,,,,,,,
demographics_survey,text,dmgcmpts, Demograhics Survey Completed Timestamp (from REDCap),,,,,,,,,,,,
health_survey,text,mhcmpdat,Health survey date,,,,,,,,,,,,
health_survey,text,crcid_mh,Interviewer Code,,,,,,,,,,,,
health_survey,checkbox,mh_nd,No participant response,,,,,,,,,,,"999, Recruitment survey not done",
health_survey,radio,mhoccur_mi,Heart attack,40761439,Ever told by doctor that you had a myocardial infarction or heart attack,Observation,LOINC,Clinical Observation,S,58338-5,,,,"1, Yes | 0, No | 777, Prefer not to say",
health_survey,radio,mhoccur_cvdot,"Other heart issues (Examples: pacemaker, heart valve disease, open heart surgery)",40766916,Has doctor ever told you that you had heart trouble [PhenX],Observation,LOINC,Clinical Observation,S,64204-1,,,,"1, Yes | 0, No | 777, Prefer not to say",
health_survey,radio,mhoccur_strk,Stroke,40768407,Have you ever been told by a physician that you had a stroke [PhenX],Observation,LOINC,Clinical Observation,S,65718-9,,,,"1, Yes | 0, No | 777, Prefer not to say",
health_survey,radio,mhoccur_circ,"Circulation problems (Examples: arteriosclerosis, atherosclerosis, blood clots in lungs or leg veins)",,,,,,,,,,,"1, Yes | 0, No | 777, Prefer not to say",
health_survey,radio,mhoccur_clsh,High blood cholesterol,40761393,Ever told by doctor or nurse that you have high blood cholesterol,Observation,LOINC,Clinical Observation,S,58292-4,,,,"1, Yes | 0, No | 777, Prefer not to say",
health_survey,radio,mhoccur_hbp,High blood pressure,40761396,Ever told by doctor or nurse that you have high blood pressure,Observation,LOINC,Clinical Observation,S,58295-7,,,,"1, Yes | 0, No | 777, Prefer not to say",
health_survey,radio,mhoccur_lbp,Low blood pressure,,,,,,,,,,,"1, Yes | 0, No | 777, Prefer not to say",
health_survey,radio,mhoccur_pd,Parkinson's disease,,,,,,,,,,,"1, Yes | 0, No | 777, Prefer not to say",
health_survey,radio,mhoccur_ad,"Dementia (Examples: Alzheimer's Disease, vascular dementia, etc)",,,,,,,,,,,"1, Yes | 0, No | 777, Prefer not to say",
health_survey,radio,mhcat_adot,"If yes, please choose between:",,,,,,,,,,,"1, Alzheimer's disease | 888, Other | 999, Unsure from the options listed | 777, Prefer not to say",
health_survey,text,mhcat_dmtaot,Other (please specify):,,,,,,,,,,,,
health_survey,radio,mhoccur_cogn,"Mild cognitive impairment (known as ""MCI""; mild but noticeable cognitive changes, may slow or interfere with daily activities but does not stop them)",,,,,,,,,,,"1, Yes | 0, No | 777, Prefer not to say",
health_survey,radio,mhoccur_ms,Multiple sclerosis,,,,,,,,,,,"1, Yes | 0, No | 777, Prefer not to say",
health_survey,radio,mhoccur_cns,Other neurological conditions,,,,,,,,,,,"1, Yes | 0, No | 777, Prefer not to say",
health_survey,text,mhoccur_cnsot,"If yes, please specify:",,,,,,,,,,,,
health_survey,radio,mhoccur_ra,Arthritis (joint pain),,,,,,,,,,,"1, Yes | 0, No | 777, Prefer not to say",
health_survey,radio,mhoccur_oa,Osteoporosis,,,,,,,,,,,"1, Yes | 0, No | 777, Prefer not to say",
health_survey,radio,mhoccur_ca,Cancer (any type),,,,,,,,,,,"1, Yes | 0, No | 777, Prefer not to say",
health_survey,text,mhoccur_cnrot,"If yes, please specify:",,,,,,,,,,,,
health_survey,radio,mhoccur_plm,"Chronic pulmonary (lung) problems (Examples: emphysema, asthma, tuberculosis, asbestosis)",,,,,,,,,,,"1, Yes | 0, No | 777, Prefer not to say",
health_survey,radio,mhoccur_gi,"Digestive problems (Examples: stomach ulcer, gastrointestinal problems, hiatal hernia)",,,,,,,,,,,"1, Yes | 0, No | 777, Prefer not to say",
health_survey,radio,mhoccur_ua,"Urinary problems (Examples: urinary tract infections, incontinence, prostate problems)",,,,,,,,,,,"1, Yes | 0, No | 777, Prefer not to say",
health_survey,radio,mhoccur_rnl,Kidney problems,,,,,,,,,,,"1, Yes | 0, No | 777, Prefer not to say",
health_survey,radio,mhoccur_ear,Hearing impairment,,,,,,,,,,,"1, Yes | 0, No | 777, Prefer not to say",
health_survey,radio,mhoccur_obs,Obesity,,,,,,,,,,,"1, Yes | 0, No | 777, Prefer not to say",
health_survey,radio,fh_dm2pt,Were either of your parents diagnosed with Type II Diabetes?,,,,,,,,,,,"1, Yes | 0, No | 555, Unknown | 777, Prefer not to say",
health_survey,checkbox,fh_dm2ptsp,"If yes, which parent?",,,,,,,,,,,"1, Mother | 2, Father",
health_survey,radio,fh_dm2sb,Has a sibling been diagnosed with Type II Diabetes?,,,,,,,,,,,"1, Yes | 0, No | 555, Unknown | 777, Prefer not to say",
health_survey,checkbox,fh_dm2sbsp,"If yes, please check all that apply:",,,,,,,,,,,"1, Sister | 2, Brother | 3, Half-Sister | 4, Half-Brother",
health_survey,radio,mhoccur_glc,Glaucoma (in one or both eyes),,,,,,,,,,,"1, Yes | 0, No | 777, Prefer not to say",
health_survey,radio,mhoccur_amd,Age-related macular degeneration (AMD) (in one or both eyes),,,,,,,,,,,"1, Yes | 0, No | 777, Prefer not to say",
health_survey,radio,mhoccur_crt,Cataracts (in one or both eyes),,,,,,,,,,,"1, Yes | 0, No | 777, Prefer not to say",
health_survey,radio,mhoccur_pdr,Diabetic retinopathy (in one or both eyes),,,,,,,,,,,"1, Yes | 0, No | 777, Prefer not to say",
health_survey,radio,mhoccur_rvo,"Retinal vascular occlusion (""stroke in the eye or eye vessels"" - in one or both eyes)",,,,,,,,,,,"1, Yes | 0, No | 777, Prefer not to say",
health_survey,radio,mhoccur_ded,Dry eye (in one or both eyes),,,,,,,,,,,"1, Yes | 0, No | 777, Prefer not to say",
health_survey,radio,mhoccur_yn,"Have you been diagnosed with any conditions not listed above? (any condition, not just eyes)",,,,,,,,,,,"1, Yes | 0, No | 777, Prefer not to say",
health_survey,text,mhoccur_ot,"If yes, please specify:",,,,,,,,,,,,
health_survey,radio,mhoccur_fall,Have you fallen in the last 12 months? (a fall is defined as an event which results in a person coming to rest inadvertently on the ground or floor or other lower level),,,,,,,,,,,"1, Yes | 0, No | 777, Prefer not to say",
health_survey,text,mhoccur_fallot,"If so, how many times in the last 12 months?",,,,,,,,,,,,
health_survey,text,mhstartts, Health Survey Started Timestamp (from REDCap),,,,,,,,,,,,
health_survey,text,mhcmpts, Heath Survey Completed Timestamp (from REDCap),,,,,,,,,,,,
substance_use_survey,text,sucmpdat,Substance use survey date,,,,,,,,,,,,
substance_use_survey,text,crcid_su,Interviewer Code,,,,,,,,,,,,
substance_use_survey,checkbox,su_nd,No participant response,,,,,,,,,,,"999, Substance Use survey not done",
substance_use_survey,radio,susmkncf,Have you smoked at least 100 cigarettes or more in your lifetime?  (100 cigarettes = 5 packs),40766306,Smoked at least 100 cigarettes in entire life,Observation,LOINC,Clinical Observation,S,63581-3,,,,"1, Yes | 0, No | 777, Prefer not to say",
substance_use_survey,dropdown,susmkstaage,At what age did you start smoking? (Age started - years old),,,,,,,,,,,"5, 5 | 6, 6 | 7, 7 | 8, 8 | 9, 9 | 10, 10 | 11, 11 | 12, 12 | 13, 13 | 14, 14 | 15, 15 | 16, 16 | 17, 17 | 18, 18 | 19, 19 | 20, 20 | 21, 21 | 22, 22 | 23, 23 | 24, 24 | 25, 25 | 26, 26 | 27, 27 | 28, 28 | 29, 29 | 30, 30 | 31, 31 | 32, 32 | 33, 33 | 34, 34 | 35, 35 | 36, 36 | 37, 37 | 38, 38 | 39, 39 | 40, 40 | 41, 41 | 42, 42 | 43, 43 | 44, 44 | 45, 45 | 46, 46 | 47, 47 | 48, 48 | 49, 49 | 50, 50 | 51, 51 | 52, 52 | 53, 53 | 54, 54 | 55, 55 | 56, 56 | 57, 57 | 58, 58 | 59, 59 | 60, 60 | 98, More than 60 years old | 999, Prefer not to say",
substance_use_survey,radio,susmkcdur,Do you smoke now?,40766945,Current smoker,Observation,LOINC,Clinical Observation,S,64234-8,,,,"1, Yes | 0, No | 777, Prefer not to say",
substance_use_survey,dropdown,susmkstoage,How many total years have you smoked?,,,,,,,,,,,"1, 1 | 2, 2 | 3, 3 | 4, 4 | 5, 5 | 6, 6 | 7, 7 | 8, 8 | 9, 9 | 10, 10 | 11, 11 | 12, 12 | 13, 13 | 14, 14 | 15, 15 | 16, 16 | 17, 17 | 18, 18 | 19, 19 | 20, 20 | 21, 21 | 22, 22 | 23, 23 | 24, 24 | 25, 25 | 26, 26 | 27, 27 | 28, 28 | 29, 29 | 30, 30 | 31, 31 | 32, 32 | 33, 33 | 34, 34 | 35, 35 | 36, 36 | 37, 37 | 38, 38 | 39, 39 | 40, 40 | 41, 41 | 42, 42 | 43, 43 | 44, 44 | 45, 45 | 46, 46 | 47, 47 | 48, 48 | 49, 49 | 50, 50 | 51, 51 | 52, 52 | 53, 53 | 54, 54 | 55, 55 | 56, 56 | 57, 57 | 58, 58 | 59, 59 | 60, 60 | 98, More than 60 years | 999, Prefer not to say",
substance_use_survey,dropdown,susmkdosfr,On average how many cigarettes do/did you usually smoke in a day? (Number of cigarettes | 20 cigarettes = 1 pack),,,,,,,,,,,"1, 1 | 2, 2 | 3, 3 | 4, 4 | 5, 5 | 6, 6 | 7, 7 | 8, 8 | 9, 9 | 10, 10 | 11, 11 | 12, 12 | 13, 13 | 14, 14 | 15, 15 | 16, 16 | 17, 17 | 18, 18 | 19, 19 | 20, 20 | 21, 21-30 (up to 1.5 packs) | 31, 31-40 (up to  2 packs) | 41, 41-50 (up to 2.5 packs) | 51, More than 50 (3 or more packs) | 999, Prefer not to say",
substance_use_survey,radio,sualckncf,Have you ever consumed alcohol?,,,,,,,,,,,"1, Yes | 0, No | 777, Prefer not to say",
substance_use_survey,dropdown,sualcage,At what age did you start drinking alcohol? (Age started - years old),,,,,,,,,,,"5, 5 | 6, 6 | 7, 7 | 8, 8 | 9, 9 | 10, 10 | 11, 11 | 12, 12 | 13, 13 | 14, 14 | 15, 15 | 16, 16 | 17, 17 | 18, 18 | 19, 19 | 20, 20 | 21, 21 | 22, 22 | 23, 23 | 24, 24 | 25, 25 | 26, 26 | 27, 27 | 28, 28 | 29, 29 | 30, 30 | 31, 31 | 32, 32 | 33, 33 | 34, 34 | 35, 35 | 36, 36 | 37, 37 | 38, 38 | 39, 39 | 40, 40 | 41, 41 | 42, 42 | 43, 43 | 44, 44 | 45, 45 | 46, 46 | 47, 47 | 48, 48 | 49, 49 | 50, 50 | 51, 51 | 52, 52 | 53, 53 | 54, 54 | 55, 55 | 56, 56 | 57, 57 | 58, 58 | 59, 59 | 60, 60 | 98, More than 60 years old | 999, Prefer not to say",
